objectid,subject,title,filename,NTEEC,NAICS,format,LEGALNAME,ALTNAME,AKADBA,ADSTREET,ADCITY,ADSTATE,ADZIP,ADZIP5,web_url,TAXPER15,INCOME15,REVENUE15,date,longitude,latitude,GSTREET,GCITY,GSTATE,GZIP
8401701081,Children's museum,CHILDREN'S MUSEUM OF ILLINOIS,demo_001.jpg,A52,712110,image/jpeg,CHILDRENS MUSEUM OF ILLINOIS,CHILDREN'S MUSEUM OF ILLINOIS,,55 S COUNTRY CLUB RD,DECATUR,IL,62521,62521,,201406,634802,561601,1989,-88.90678,39.82843,55 S COUNTRY CLUB RD,DECATUR,IL,62521-4470
8401701105,Children's museum,ORPHEUM CHILDREN'S SCIENCE MUSEUM,demo_001.jpg,A52,712110,image/jpeg,ORPHEUM CHILDRENS SCIENCE MUSEUM INC,ORPHEUM CHILDREN'S SCIENCE MUSEUM,,346 N NEIL ST,CHAMPAIGN,IL,61820-3614,61820,,201312,254960,233322,1996,-88.24346,40.11868,346 N NEIL ST,CHAMPAIGN,IL,61820-3614
8401701109,Children's museum,CHILDREN'S DISCOVERY MUSEUM,demo_001.jpg,A52,712110,image/jpeg,TOWN OF NORMAL CHILDRENS DISCOVERY MUSEUM FOUNDATION,,TOWN OF NORMAL CHILDRENS DISCOVERY MUSEUM FOUNDATION,11 UPTOWN CIR,NORMAL,IL,61761-8701,61761,HTTP://WWW.CHILDRENSDISCOVERYMUSEUM.NET/,201406,106052,84288,1993,-88.98372,40.50939,101 EAST BEAUFORT STREET,NORMAL,IL,61761-8701
8401701144,Children's museum,DISCOVERY DEPOT CHILDREN'S MUSEUM,demo_001.jpg,A52,712110,image/jpeg,GALESBURG MUSEUMS INC,,,128 S CHAMBERS ST,GALESBURG,IL,61401-4966,61401,HTTP://WWW.DISCOVERYDEPOT.ORG,201312,534595,532653,1996,-90.36247,40.94677,128 S CHAMBERS ST,GALESBURG,IL,61401-4966
8401701168,Children's museum,CHILDREN'S MUSEUM OF EDWARDSVILLE,demo_001.jpg,A50,712110,image/jpeg,EDWARDSVILLE CHILDRENS MUSEUM INC,,,722 HOLYOAKE RD,EDWARDSVILLE,IL,62025-2313,62025,,201406,130676,130676,1999,-89.94994,38.8039,722 HOLYOAKE RD,EDWARDSVILLE,IL,62025-2313
8401800088,Children's museum,KOCH FAMILY CHILDREN'S MUSEUM OF EVANSVILLE,demo_001.jpg,A52,712110,image/jpeg,LOUIS J KOCH FAMILY CHILDRENS MUSEUM OF EVANSVILLE INC,,,1102 WASHINGTON SQ,EVANSVILLE,IN,47715,47715,HTTP://WWW.CMOEKIDS.ORG/,201406,888531,847404,1995,-87.56978,37.97198,22 S E FIFTH STREET,EVANSVILLE,IN,47715
8401800321,Children's museum,TERRE HAUTE CHILDREN'S MUSEUM,demo_001.jpg,A52,712110,image/jpeg,TERRE HAUTE CHILDRENS MUSEUM INC,,,727 WABASH AVE,TERRE HAUTE,IN,47807-3203,47807,,201312,682358,641900,1988,-87.40668,39.46639,727 WABASH AVE,TERRE HAUTE,IN,47807-3203
8401800343,Children's museum,CHILDREN'S MUSEUM OF INDIANAPOLIS,demo_001.jpg,A52,712110,image/jpeg,CHILDRENS MUSEUM OF INDIANAPOLIS INCORPORATED,CHILDREN'S MUSEUM OF INDIANAPOLIS,,3000 N MERIDIAN ST,INDIANAPOLIS,IN,46208-4716,46208,,201312,104067302,32674824,1952,-86.15679,39.81017,3000 N MERIDIAN ST,INDIANAPOLIS,IN,46208-4716
8401800380,Children's museum,MUNCIE CHILDREN'S MUSEUM,demo_001.jpg,A52,712110,image/jpeg,MUNCIE CHILDRENS MUSEUM INC,MUNCIE CHILDREN'S MUSEUM,,515 S HIGH ST,MUNCIE,IN,47308-1555,47308,,201312,418268,384585,1977,-85.38778,40.19012,515 S HIGH ST,MUNCIE,IN,47305-2376
8401800561,Children's museum,KIDSCOMMONS - COLUMBUS' COMMUNITY CHILDREN'S MUSEUM,demo_001.jpg,A52,712110,image/jpeg,KIDSCOMMONS COLUMBUS COMMUNITY CHILDRENS MUSEUM INC,KIDSCOMMONS...COLUMBUS' (IN) COMMUNITY CHILDREN'S MUSEUM,KIDSCOMMONS COLUMBUS COMMUNITY CHILDRENS MUSEUM INC,309 WASHINGTON ST,COLUMBUS,IN,47201-6743,47201,HTTP://WWW.KIDSCOMMONS.ORG,201312,457887,437992,1998,-85.92093,39.20162,309 WASHINGTON ST,COLUMBUS,IN,47201-6743
8401800589,Children's museum,GARY CHILDREN'S MUSEUM,demo_001.jpg,A50,,image/jpeg,THE GARY CHILDRENS MUSEUM INC,,,273 CLEVELAND ST,GARY,IN,46404,46404,,,,,,-87.36169,41.60651,273 CLEVELAND ST,GARY,IN,46404
8401800730,Children's museum,CHILDREN'S MUSEUM OF CEDAR LAKE,demo_001.jpg,,,image/jpeg,CHILDRENS MUSEUM OF CEDAR LAKE,,,9430 WEST 135TH PLACE,CEDAR LAKE,IN,46303,46303,,,,,,-87.44719,41.38042,9430 WEST 135TH PLACE,CEDAR LAKE,IN,46303
8401900336,"Zoos, Aquariums ",SUNRISE CHILDREN'S ZOO,demo_001.jpg,D50,712130,image/jpeg,SUNRISE CHILDRENS ZOO INC,,,BOX 1102,WATERLOO,IA,50704-5070,50704,,201404,0,0,1975,-92.37126,42.5094,250 ANSBOROUGH AVE,WATERLOO,IA,50704-5070
8401900554,Children's museum,FELIX ADLER CHILDREN'S DISCOVERY CENTER,demo_001.jpg,A52,712110,image/jpeg,IOWA CHILDRENS MUSEUM,FELIX ADLER MEMORIAL ASSOCIATION,,1451 CORAL RIDGE AVE,CORALVILLE,IA,52241-2800,52241,HTTP://WWW.ICM.ORG,201406,1429196,1294456,1996,-91.60832,41.69101,1451 CORAL RIDGE AVE,CORALVILLE,IA,52241-2800
8401900656,Children's museum,CHILDREN'S MUSEUM OF SIOUXLAND,demo_001.jpg,A52,712110,image/jpeg,CHILDRENS MUSEUM OF SIOUXLAND INC,,,PO BOX 833,SIOUX CITY,IA,51102-0833,51102,HTTP://WWW.CHILDRENSMUSEUMOFSIOUXLAND.ORG/,201206,40255,40255,2007,-96.408,42.49638,623 PEARL ST,SIOUX CITY,IA,51102-0833
8402000211,Children's museum,KANSAS CHILDREN'S DISCOVERY CENTER,demo_001.jpg,A50,712110,image/jpeg,KANSAS CHILDRENS DISCOVERY CENTER INC,KANSAS CHILDREN'S DISCOVERY CENTER,,4400 SW 10TH AVE,TOPEKA,KS,66604-1959,66604,HTTP://WWW.KANSASDISCOVERY.ORG,201312,710707,710707,2007,-95.72718,39.0513,4400 SW 10TH AVE,TOPEKA,KS,66604-1959
8402000346,Children's museum,CHILDREN'S MUSEUM OF KANSAS CITY,demo_001.jpg,A52,,image/jpeg,CHILDREN'S MUSEUM OF KANSAS CITY,CHILDREN'S MUSEUM OF KANSAS CITY,,4601 STATE AVE,KANSAS CITY,KS,66102-3603,66102,,,,,,-94.68608,39.11661,4601 STATE AVE,KANSAS CITY,KS,66102-3603
8402100051,Children's museum,LEXINGTON CHILDREN'S MUSEUM,demo_001.jpg,,,image/jpeg,LEXINGTON CHILDRENS MUSEUM,,,200 E MAIN ST,LEXINGTON,KY,40507,40507,,,,,,-84.49876,38.04782,200 E MAIN ST,LEXINGTON,KY,40507
8402100231,Children's museum,LOUISVILLE CHILDREN'S MUSEUM,demo_001.jpg,A50,712110,image/jpeg,LOUISVILLE CHILDRENS MUSEUM,,,1312 ISLEWORTH DR,LOUISVILLE,KY,40245-4024,40245,HTTP://LOUISVILLECHILDRENSMUSEUM.ORG/,201312,0,0,2012,-85.76172,38.25727,727 W MAIN ST,LOUISVILLE,KY,40245-4024
8402200178,Children's museum,CHILDREN'S MUSEUM OF ST. TAMMANY,demo_001.jpg,A50,712110,image/jpeg,CHILDRENS MUSEUM OF ST TAMMANY INC,,,PO BOX 5351,COVINGTON,LA,70434-5351,70434,HTTP://CMSTKIDS.ORG/,201412,247852,188068,2013,-90.09262,30.46635,PO BOX 5351,COVINGTON,LA,70434-5351
8402200204,Children's museum,CHILDREN'S MUSEUM OF ACADIANA,demo_001.jpg,A52,712110,image/jpeg,CHILDRENS MUSEUM OF ACADIANA,CHILDREN'S MUSEUM OF ACADIANA  INC.,,201 E CONGRESS ST,LAFAYETTE,LA,70501-6919,70501,HTTP://WWW.CHILDRENSMUSEUMOFACADIANA.COM/HOME,201407,484796,461471,1991,-92.01766,30.2253,201 E CONGRESS ST,LAFAYETTE,LA,70501-6919
8402200254,Children's museum,LOUISIANA CHILDREN'S MUSEUM,demo_001.jpg,A52,712110,image/jpeg,LOUISIANA CHILDRENS MUSEUM,LOUISIANA CHILDREN'S MUSEUM,,420 JULIA ST,NEW ORLEANS,LA,70156-6128,70156,HTTP://LCM.ORG/,201312,3516451,3332789,1982,-90.07662,29.94845,PO BOX 56128,NEW ORLEANS,LA,70156-6128
8402200277,Children's museum,CHILDREN'S MUSEUM OF LAKE CHARLES,demo_001.jpg,A52,712110,image/jpeg,THE CHILDRENS MUSEUM OF LAKE CHARLES INC,,,327 BROAD ST,LAKE CHARLES,LA,70601-4223,70601,,201312,369057,365390,1988,-93.21588,30.22994,327 BROAD ST,LAKE CHARLES,LA,70601-4223
8402200325,Children's museum,NORTHEAST LOUISIANA CHILDREN'S MUSEUM,demo_001.jpg,A52,712110,image/jpeg,NORTHEAST LOUISIANA CHILDRENS MUSEUM INC,,,323 WALNUT ST,MONROE,LA,71201-6711,71201,HTTP://NELCM.ORG/,201406,344247,239476,1995,-92.12068,32.50507,323 WALNUT ST,MONROE,LA,71201-6711
8402200379,Children's museum,BAYOU COUNTRY CHILDREN'S MUSEUM,demo_001.jpg,A52,712110,image/jpeg,BAYOU COUNTRY CHILDRENS MUSEUM,,,1001 CANAL BLVD,THIBODAUX,LA,70302-1093,70302,HTTP://WWW.BAYOUCOUNTRYCHILDRENSMUSEUM.ORG,201312,913546,864249,2000,-90.80176,29.76235,211 RUE BETANCOURT,THIBODAUX,LA,70302-1093
8402300135,Children's museum,CHILDREN'S MUSEUM & THEATRE OF MAINE,demo_001.jpg,A52,712110,image/jpeg,CHILDRENS MUSEUM AND THEATRE OF MAINE,CHILDREN'S MUSEUM OF MAINE,,142 FREE ST,PORTLAND,ME,04101-3961,4101,HTTP://WWW.KITETAILS.ORG/,201406,1308691,1190412,1977,-70.26237,43.65418,142 FREE ST,PORTLAND,ME,04101-3961
8402300206,Children's museum,COASTAL CHILDREN'S MUSEUM,demo_001.jpg,,712110,image/jpeg,THE COASTAL CHILDRENS MUSEUM,,,75 MECHANIC STREET,ROCKLAND,ME,4841,4841,HTTP://WWW.COASTALCHILDRENSMUSEUM.ORG,201403,0,0,1988,-69.10757,44.09328,75 MECHANIC ST,ROCKLAND,ME,04841-3513
8402300222,Children's museum,CHILDREN'S DISCOVERY MUSEUM,demo_001.jpg,A52,712110,image/jpeg,CHILDRENS DISCOVERY MUSEUM,,,171 CAPITOL STREET SUITE 2,AUGUSTA,ME,04330-6232,4330,HTTP://WWW.CHILDRENSDISCOVERYMUSEUM.ORG,201312,118524,116943,1990,-69.79277,44.31005,171 CAPITOL STREET SUITE,AUGUSTA,ME,04330-6232
8402300406,Children's museum,CARIBOU CHILDREN'S DISCOVERY MUSEUM,demo_001.jpg,A52,,image/jpeg,CARIBOU CHILDREN S DISCOVERY MUSEUM,,,PO BOX 487,CARIBOU,ME,04736-0487,4736,,,,,,-68.01986,46.86824,PO BOX 487,CARIBOU,ME,04736-0487
8402400042,Children's museum,NATIONAL CHILDREN'S MUSEUM,demo_001.jpg,,712110,image/jpeg,NATIONAL CHILDREN'S MUSEUM,,,151 ST GEORGE BOULEVARD,NATIONAL HARBOR,MD,20745,20745,HTTP://WWW.CCM.ORG,201306,1981941,2910829,1974,-77.00281,38.78897,151 ST GEORGE BOULEVARD,NATIONAL HARBOR,MD,20745
8402400232,Children's museum,DISCOVER U CHILDREN'S MUSEUM,demo_001.jpg,A52,712110,image/jpeg,DISCOVER U CHILDRENS MUSEUM INC,,,PO BOX 1938,LEONARDTOWN,MD,20650-1938,20650,,201404,0,0,2009,-76.61243,38.24872,21081 ROSEBAY ST,LEONARDTOWN,MD,20650-3631
8402400257,Children's museum,CHILDREN'S MUSEUM OF OF THE EASTERN SHORE,demo_001.jpg,A52,712110,image/jpeg,CHILDRENS MUSEUM OF THE EASTERN SHORE INC,,,8 CHELSEA DRIVE,CAMBRIDGE,MD,21613-1214,21613,HTTP://WWW.CHILDRENSMUSEUMES.ORG/WP1/,201312,0,0,2010,-76.08746,38.58454,8 CHELSEA DR,CAMBRIDGE,MD,21613-1214
8402400477,Children's museum,PORT DISCOVERY CHILDREN'S MUSEUM,demo_001.jpg,A52,712110,image/jpeg,BALTIMORE CHILDRENS MUSEUM INC,,,35 MARKET PL,BALTIMORE,MD,21202-4002,21202,HTTP://WWW.PORTDISCOVERY.ORG,201406,3926259,3823338,1993,-76.60697,39.28861,35 MARKET PL,BALTIMORE,MD,21202-4002
8402400478,Children's museum,CHESAPEAKE CHILDREN'S MUSEUM,demo_001.jpg,A52,712110,image/jpeg,CHESAPEAKE CHILDRENS MUSEUM INC,CHESAPEAKE CHILDREN'S MUSEUM,,25 SILOPANNA RD,ANNAPOLIS,MD,21403-1117,21403,HTTP://WWW.THECCM.ORG,201312,81910,81910,1994,-76.50838,38.96812,25 SILOPANNA RD,ANNAPOLIS,MD,21403-1117
8402500155,Children's museum,CHILDREN'S MUSEUM IN EASTON,demo_001.jpg,A52,712110,image/jpeg,EASTON CHILDRENS MUSEUM INC,EASTON CHILDREN'S MUSEUM,,9 SULLIVAN AVE,NORTH EASTON,MA,2356,2356,HTTP://WWW.CHILDRENSMUSEUMINEASTON.ORG/HOME0.ASPX,201312,469834,441047,1987,-71.08991,42.0673,PO BOX 417,NORTH EASTON,MA,02356-0417
8402500441,Children's museum,CHILDREN'S MUSEUM OF WORCESTER,demo_001.jpg,A52,,image/jpeg,CHILDREN S MUSEUM OF WORCESTER,CHILDREN S MUSEUM OF WORCESTER,,54 BEECHING ST,WORCESTER,MA,01602-1402,1602,HTTP://WWW.ECOTARIUM.ORG,,,,,-71.76666,42.26176,222 HARRINGTON WAY,WORCESTER,MA,01602-1402
8402500455,Children's museum,CAPE COD CHILDREN'S MUSEUM,demo_001.jpg,A52,712110,image/jpeg,CHILDRENS DISCOVERY MUSEUM OF CAPE COD INC,CAPE COD CHILDREN'S MUSEUM,,577 GREAT NECK RD S,MASHPEE,MA,02649-3708,2649,HTTP://CAPECODCHILDRENSMUSEUM.ORG/,201403,398142,359039,1992,-70.47769,41.58974,577 GREAT NECK RD S,MASHPEE,MA,02649-3708
8402500497,Children's museum,AMELIA PARK CHILDREN'S MUSEUM,demo_001.jpg,A52,712110,image/jpeg,AMELIA PARK CHILDRENS MUSEUM INC,,,PO BOX 931,WESTFIELD,MA,01086-0931,1086,HTTP://WWW.AMELIAPARKMUSEUM.ORG/,201406,152204,152204,1996,-72.74782,42.11175,29 S BROAD ST,WESTFIELD,MA,01086-0931
8402500524,Children's museum,CHILDREN'S MUSEUM OF WILBRAHAM,demo_001.jpg,A52,712110,image/jpeg,CHILDRENS MUSEUM OF WILBRAHAM INC,,,PO BOX 522,WILBRAHAM,MA,01095-0522,1095,HTTP://WWW.WILBRAHAMCHILDRENSMUSEUM.ORG,201406,0,0,1998,-72.43558,42.11013,678 MAIN ST,WILBRAHAM,MA,01095-0522
8402500539,Children's museum,CHILDREN S MUSEUM LOWELL,demo_001.jpg,A52,,image/jpeg,CHILDREN S MUSEUM LOWELL INC,,,11 KEARNEY SQ,LOWELL,MA,01852-1941,1852,,,,,,-71.30718,42.64526,11 KEARNEY SQ,LOWELL,MA,01852-1941
8402500584,Children's museum,CHILDREN'S MUSEUM OF GREATER FALL RIVER,demo_001.jpg,A50,712110,image/jpeg,CHILDRENS MUSEUM OF GREATER FALL RIVER INC,,,441 NORTH MAIN STREET,FALL RIVER,MA,02720-2407,2720,HTTP://WWW.CMGFR.ORG/INDEX.PHP?LANG=EN,201406,192544,181273,2001,-71.15532,41.70264,44I NORTH MAIN STREET,FALL RIVER,MA,02720-0000
8402500596,Children's museum,CHILDREN'S GLOBAL DISCOVERY MUSEUM,demo_001.jpg,A52,712110,image/jpeg,CHILDRENS GLOBAL DISCOVERY MUSEUM,,,100 SOHIER ST,COHASSET,MA,02025-1374,2025,HTTP://WWW.OURWORLDCGDM.ORG,201312,116837,116863,2002,-70.81426,42.23904,100 SOHIER ST,COHASSET,MA,02025-1374
8402500691,Children's museum,CHILDREN'S MUSEUM,demo_001.jpg,,,image/jpeg,CHILDRENS MUSEUM INC,,,25 S WATER ST,NEW BEDFORD,MA,2740,2740,,,,,,-70.92349,41.63409,25 S WATER ST,NEW BEDFORD,MA,2740
8402501093,Children's museum,SHANGHAI DISCOVERY CHILDREN'S MUSEUM,demo_001.jpg,,,image/jpeg,SHANGHAI DISCOVERY CHILDRENS MUSEUM,,,11 POWDER HILL RD,BOLTON,MA,1740,1740,,,,,,-71.59416,42.43958,11 POWDER HILL RD,BOLTON,MA,1740
8402600182,Children's museum,DETROIT CHILDREN'S MUSEUM,demo_001.jpg,,,image/jpeg,DETROIT CHILDREN'S MUSEUM,,,6134 2ND AVE,DETROIT,MI,48202,48202,HTTP://WWW.DETROITSCIENCECENTER.ORG,,,,,-83.07397,42.36478,6134 2ND AVE,DETROIT,MI,48202
8402600424,Children's museum,CHILDREN'S MUSEUM OF LENAWEE,demo_001.jpg,A50,,image/jpeg,CHILDRENS MUSEUM OF LENAWEE,,,PO BOX 632,ADRIAN,MI,49221,49221,,,,,,-84.10406,41.93106,PO BOX 632,ADRIAN,MI,49221
8402600427,Children's museum,SANDCASTLES A LAKE MICHIGAN CHILDREN'S MUSEUM,demo_001.jpg,A52,712110,image/jpeg,SANDCASTLES A LAKE MICHIGAN CHILDRENS MUSEUM INC,,,PO BOX 595,LUDINGTON,MI,49431-0595,49431,HTTP://WWW.SANDCASTLESCHILDRENSMUSEUM.COM/,201412,208077,196998,2008,-86.44759,43.95568,129 E LUDINGTON AVENUE,LUDINGTON,MI,49431-0595
8402600562,Children's museum,FLINT CHILDREN'S MUSEUM,demo_001.jpg,A52,712110,image/jpeg,FLINT CHILDRENS MUSEUM,,,1602 UNIVERSITY AVE,FLINT,MI,48504-6212,48504,HTTP://THEFCM.ORG/,201409,445830,437489,1982,-83.71129,43.014,1602 UNIVERSITY AVE,FLINT,MI,48504-6212
8402600746,Children's museum,UPPER PENINSULA CHILDREN'S MUSEUM,demo_001.jpg,A52,712110,image/jpeg,UPPER PENINSULA CHILDRENS MUSEUM INC,,,123 W BARAGA AVE,MARQUETTE,MI,49855-4744,49855,HTTP://WWW.UPCHILDRENSMUSEUM.COM/,201312,379919,363778,1995,-87.39479,46.54082,123 W BARAGA AVE,MARQUETTE,MI,49855-4744
8402600778,Children's museum,GRAND RAPIDS CHILDREN'S MUSEUM,demo_001.jpg,A52,712110,image/jpeg,GRAND RAPIDS CHILDRENS MUSEUM,,,11 SHELDON AVE NE,GRAND RAPIDS,MI,49503-3246,49503,,201309,1126099,986968,1993,-85.66686,42.96332,11 SHELDON AVE NE,GRAND RAPIDS,MI,49503-3218
8402600883,Children's museum,KEWEENAW CHILDREN'S MUSEUM,demo_001.jpg,,,image/jpeg,KEWEENAW CHILDRENS MUSEUM INC,,,700 PARK AVE,HOUGHTON,MI,49931,49931,,,,,,-88.58852,47.11535,700 PARK AVE,HOUGHTON,MI,49931
8402600890,Children's museum,GREAT LAKES CHILDREN'S MUSEUM,demo_001.jpg,A52,712110,image/jpeg,THE GREAT LAKES CHILDRENS MUSEUM,,,13240 S WEST BAY SHORE DR,TRAVERSE CITY,MI,49684-5570,49684,HTTP://GREATLAKESKIDS.ORG/,201406,767702,415371,2000,-85.65649,44.77569,13240 S WEST BAY SHORE D,TRAVERSE CIT,MI,49684-5570
8402600897,Children's museum,MIDLAND CHILDREN'S MUSEUM,demo_001.jpg,A50,712110,image/jpeg,THE MIDLAND CHILDRENS MUSEUM,,,5212 HUNTINGTON DRIVE,MIDLAND,MI,48640,48640,HTTP://WWW.MCFTA.ORG/,201412,0,0,2014,-84.25004,43.62518,1801 W SAINT ANDREWS ROAD,MIDLAND,MI,48640
8402600906,Children's museum,MID-MICHIGAN CHILDREN'S MUSEUM,demo_001.jpg,A52,712110,image/jpeg,MID-MICHIGAN CHILDRENS MUSEUM,,,315 W GENESEE AVE,SAGINAW,MI,48605-2283,48605,HTTP://WWW.MIDMICM.ORG,201312,412009,391400,2000,-83.94643,43.41961,PO BOX 2283,SAGINAW,MI,48605-2283
8402600934,Children's museum,FOREVER CURIOUS CHILDREN'S MUSEUM,demo_001.jpg,A52,712110,image/jpeg,FOREVER CURIOUS CHILDRENS MUSEUM,,,PO BOX LI01,FENNVILLE,MI,49408-1101,49408,HTTP://FOREVERCURIOUSMUSEUM.ORG/,201312,65051,59148,2002,-86.10323,42.59418,202 E MAIN ST,FENNVILLE,MI,49408-1101
8402601026,Children's museum,MACOMB CHILDREN'S HANDS ON MUSEUM,demo_001.jpg,A52,712110,image/jpeg,MACOMB CHILDRENS HANDS ON MUSEUM INC,,,PO BOX 463101,MOUNT CLEMENS,MI,48046-3101,48046,,201409,0,0,2012,-82.88018,42.59244,PO BOX 463101,MOUNT CLEMEN,MI,48046-3101
8402700102,Children's museum,CHILDREN'S MUSEUM OF SOUTHERN MINNESOTA,demo_001.jpg,A52,712110,image/jpeg,CHILDRENS MUSEUM OF SOUTHERN MINNESOTA,,,121 E CHERRY ST,MANKATO,MN,56001,56001,HTTP://WWW.CMSOUTHERNMN.ORG,201312,2649491,2638552,2006,-94.01399,44.16147,224 LAMM STREET,MANKATO,MN,56001
8402700252,Children's museum,GREAT RIVER CHILDREN'S EXPLORATORIUM,demo_001.jpg,A52,712110,image/jpeg,GREAT RIVER CHILDRENS EXPLORATORIUM,,,1126 7TH AVE N,SAINT CLOUD,MN,56303-2804,56303,,,,,2013,-94.16945,45.57073,1126 7TH AVE N,SAINT CLOUD,MN,56303-2804
8402700303,History Museums,DULUTH CHILDREN'S MUSEUM,demo_001.jpg,A54,712110,image/jpeg,DULUTH CHILDRENS MUSEUM INC,DULUTH CHILDREN'S MUSEUM,,115 S 29TH AVE W,DULUTH,MN,55806-1761,55806,HTTP://WWW.DULUTHCHILDRENSMUSEUM.ORG,201406,2060267,2060267,1951,-92.1335,46.75876,115 S 29TH AVE W,DULUTH,MN,55806-1761
8402700377,Children's museum,MINNESOTA CHILDREN'S MUSEUM,demo_001.jpg,A52,712110,image/jpeg,MINNESOTA CHILDRENS MUSEUM,MINNESOTA CHILDREN'S MUSEUM,,10 7TH ST W,SAINT PAUL,MN,55102-2453,55102,HTTP://WWW.MCM.ORG,201406,9197776,8738872,1979,-93.09718,44.94798,10 7TH ST W,SAINT PAUL,MN,55102-2453
8402700503,Children's museum,LAKES AREA CHILDREN'S MUSEUM,demo_001.jpg,A52,,image/jpeg,LAKES AREA CHILDRENS MUSEUM INC,,,PO BOX 181,BRAINERD,MN,56401,56401,,,,,,-94.17339,46.3468,13240 S WEST BAY SHORE DRIVE,TRAVERSE CITY,MN,56401
8402700522,Children's museum,JUDY GARLAND CHILDREN'S MUSEUM,demo_001.jpg,A50,712110,image/jpeg,JUDY GARLAND CHILDRENS MUSEUM INC,,,PO BOX 724,GRAND RAPIDS,MN,55744-0724,55744,HTTP://WWW.JUDYGARLANDMUSEUM.COM/,201312,296875,278817,1995,-93.52635,47.23038,2727 HIGHWAY 169 SOUTH,GRAND RAPIDS,MN,55744-0724
8402800209,Children's museum,MISSISSIPPI CHILDREN'S MUSEUM,demo_001.jpg,A52,712110,image/jpeg,MISSISSIPPI CHILDRENS MUSEUM,,,PO BOX 55409,JACKSON,MS,39296-5409,39296,HTTP://WWW.MISSISSIPPICHILDRENSMUSEUM.COM,201405,3225434,2921684,2004,-90.17529,32.33448,2145 HIGHLAND DR,JACKSON,MS,39296-5409
8402900534,Children's museum,WORLDWAYS CHILDREN'S MUSEUM,demo_001.jpg,A52,,image/jpeg,WORLDWAYS CHILDRENS MUSEUM,,,733 CARMAN OAKS CT,BALLWIN,MO,63021-7071,63021,,,,,,-90.48605,38.57872,733 CARMAN OAKS CT,BALLWIN,MO,63021-7071
8402900760,Children's museum,SOUTHEAST MISSOURI CHILDREN'S MUSEUM,demo_001.jpg,A52,712110,image/jpeg,SOUTHEAST MISSOURI CHILDRENS MUSEUM,,,PO BOX 1251,CAPE GIRARDEAU,MO,63702-1251,63702,,201312,232037,227481,2006,-89.52478,37.30844,PO BOX 1251,CPE GIRARDEA,MO,63702-1251
8403000022,Children's museum,MISSOULA CHILDREN'S MUSEUM,demo_001.jpg,,,image/jpeg,MISSOULA CHILDRENS MUSEUM,MISSOULA CHILDRENS MUSEUM; FAMILIES FIRST,,225 W FRONT ST,MISSOULA,MT,59802,59802,HTTPS://WWW.CHILDRENSMUSEUMMISSOULA.ORG/,,,,,-113.99277,46.86938,225 WEST FRONT STREET,MISSOULA,MT,59802
8403000052,Children's museum,CHILDREN'S MUSEUM OF BOZEMAN,demo_001.jpg,,,image/jpeg,CHILDREN'S MUSEUM OF BOZEMAN,,,202 S WILLSON AVE,BOZEMAN,MT,59715,59715,HTTP://WWW.CMBOZEMAN.ORG,,,,,-111.03814,45.67669,202 S WILLSON AVE,BOZEMAN,MT,59715
8403000229,Science & Technology Museums and Planetariums,NORTHERN ROCKIES CHILDREN'S MUSEUM OF SCIENCE & TECHNOLOGY IN,demo_001.jpg,,,image/jpeg,NORTHERN ROCKIES CHILDRENS MUSEUM OF SCIENCE & TECHNOLOGY IN,,,111 N LAST CHANCE GULCH ST,HELENA,MT,59601,59601,,,,,,-112.03622,46.59755,995 CAROUSEL WAY,HELENA,MT,59601
8403000299,Children's museum,CHILDREN'S MUSEUM OF MONTANA,demo_001.jpg,A52,712110,image/jpeg,CHILDRENS MUSEUM OF MONTANA INC,CHILDREN'S MUSEUM OF MONTANA,,22 RAILROAD SQ,GREAT FALLS,MT,59401-4003,59401,HTTP://WWW.CHILDRENSMUSEUMOFMONTANA.ORG,201406,242113,240012,1997,-111.30721,47.50442,22 RAILROAD SQ,GREAT FALLS,MT,59401-4003
8403100181,"Zoos, Aquariums ",LINCOLN CHILDREN'S ZOO,demo_001.jpg,D50,712130,image/jpeg,LINCOLN CHILDRENS ZOO,LINCOLN CHILDREN'S ZOO,,1222 S 27TH ST,LINCOLN,NE,68502-1832,68502,HTTP://WWW.LINCOLNZOO.ORG/,201312,2492607,2377278,1994,-96.68219,40.80113,1222 S 27TH ST,LINCOLN,NE,68502-1832
8403100200,Children's museum,OMAHA CHILDREN'S MUSEUM,demo_001.jpg,A52,712110,image/jpeg,OMAHA CHILDRENS MUSEUM INC,OMAHA CHILDREN'S MUSEUM,,500 S 20TH ST,OMAHA,NE,68102-2508,68102,HTTP://WWW.OCM.ORG,201312,3329924,3055762,1978,-95.94312,41.25483,500 S 20TH ST,OMAHA,NE,68102-2508
8403100247,Children's museum,LINCOLN CHILDREN'S MUSEUM,demo_001.jpg,A52,712110,image/jpeg,LINCOLN CHILDRENS MUSEUM,LINCOLN CHILDREN'S MUSEUM,,1420 P ST,LINCOLN,NE,68508-1635,68508,HTTP://WWW.LINCOLNCHILDRENSMUSEUM.ORG/,201312,1584122,1517066,1988,-96.70024,40.81505,1420 P ST,LINCOLN,NE,68508-1635
8403100285,Children's museum,NORTH PLATTE AREA CHILDREN'S MUSEUM,demo_001.jpg,A52,712110,image/jpeg,NORTH PLATTE AREA CHILDRENS MUSEUM,,,PO BOX 2088,NORTH PLATTE,NE,69103-2088,69103,HTTP://NPCHILDRENSMUSEUM.COM/,201112,82606,82606,1998,-100.76364,41.13561,314 N JEFFERS ST,NORTH PLATTE,NE,69103-2088
8403100290,Children's museum,YORK AREA CHILDREN'S MUSEUM,demo_001.jpg,A52,712110,image/jpeg,YORK AREA CHILDRENS MUSEUM,,,306 E 7TH STREET,YORK,NE,68467-3024,68467,HTTP://WWW.YORKAREACHILDRENSMUSEUM.ORG,201412,0,0,1999,-97.59055,40.86702,612 NEBRASKA AVENUE,YORK,NE,68467-3024
8403100354,Children's museum,CHILDREN'S MUSEUM OF CENTRAL NEBRASKA,demo_001.jpg,A52,712110,image/jpeg,CHILDRENS MUSEUM OF CENTRAL NEBRASKA INC,,,PO BOX 1502,HASTINGS,NE,68902-1502,68902,HTTP://CMOCN.ORG/,201412,60952,60952,2003,-98.38512,40.58542,THE IMPERIAL MALL 12TH STREET & MARIAN ROAD,HASTINGS,NE,68902-1502
8403200140,Children's museum,CHILDREN'S MUSEUM OF NORTHERN NEVADA,demo_001.jpg,A52,712110,image/jpeg,CHILDRENS MUSEUM OF NORTHERN NEVADA INC,CHILDRENS MUSEUM OF NORTHERN NEVADA,,813 N CARSON ST,CARSON CITY,NV,89701-4009,89701,HTTP://WWW.CMNN.ORG,201406,135409,129019,1993,-119.76686,39.16911,813 N CARSON ST,CARSON CITY,NV,89701-4009
8403300049,Children's museum,KALEIDOSCOPE CHILDREN'S MUSEUM,demo_001.jpg,,,image/jpeg,KALEIDOSCOPE CHILDREN'S MUSEUM,,,8 S MAIN ST,CONCORD,NH,3301,3301,,,,,,-71.5357,43.20387,8 S MAIN ST,CONCORD,NH,3301
8403300077,Children's museum,CHILDREN'S MUSEUM-MEREDITH,demo_001.jpg,,,image/jpeg,CHILDREN'S MUSEUM-MEREDITH,,,28 LANG ST,MEREDITH,NH,3253,3253,HTTP://WWW.THEZEEUM.COM,,,,,-71.49892,43.65441,28 LANG ST,MEREDITH,NH,3253
8403300129,Children's museum,CHILDREN'S MUSEUM OF NEW HAMPSHIRE,demo_001.jpg,A52,712110,image/jpeg,THE CHILDRENS MUSEUM OF NEW HAMPSHIRE,CHILDREN'S MUSEUM OF PORTSMOUTH,,6 WASHINGTON ST,DOVER,NH,03820-3814,3820,HTTP://WWW.CHILDRENS-MUSEUM.ORG,201406,1201371,1093587,1982,-70.87194,43.19505,6 WASHINGTON ST,DOVER,NH,03820-3814
8403300170,Children's museum,CHILDREN'S MUSEUM OF CONCORD,demo_001.jpg,A52,,image/jpeg,CHILDRENS MUSEUM OF CONCORD,,,26 FOWLER ST,PENACOOK,NH,03303-1809,3303,,,,,,-71.60447,43.27119,26 FOWLER ST,PENACOOK,NH,03303-1809
8403300325,Children's museum,MOUNT WASHINGTON VALLEY CHILDREN'S MUSEUM,demo_001.jpg,A52,712110,image/jpeg,MOUNT WASHINGTON VALLEY CHILDRENS MUSEUM,,,PO BOX 2602,NORTH CONWAY,NH,03860-2602,3860,,201312,124062,121009,2005,-71.12888,44.04403,PO BOX 2602,NORTH CONWAY,NH,03860-2602
8403300351,Children's museum,CHESHIRE CHILDREN'S MUSEUM,demo_001.jpg,A52,712110,image/jpeg,CHESHIRE CHILDRENS MUSEUM,,,222 WEST ST,KEENE,NH,03431-2456,3431,HTTP://WWW.CHESHIRECHILDRENSMUSEUM.ORG,201312,135947,133142,2010,-72.28671,42.93237,222 WEST STREET,KEENE,NH,03431-2455
8403400045,Children's museum,NEW JERSEY CHILDREN'S MUSEUM,demo_001.jpg,,,image/jpeg,NEW JERSEY CHILDREN'S MUSEUM,,,599 VALLEY HEALTH PLZ,PARAMUS,NJ,7652,7652,,,,,,-74.07481,40.96264,599 VALLEY HEALTH PLZ,PARAMUS,NJ,7652
8403400112,Botanical Gardens and Nature Centers,CAMDEN CHILDREN'S GARDEN,demo_001.jpg,C42,813410,image/jpeg,CAMDEN CITY GARDEN CLUB INC,,,3 RIVERSIDE DR,CAMDEN,NJ,8103,8103,HTTP://WWW.CAMDENCHILDRENSGARDEN.ORG,201312,906030,889025,1990,-75.13026,39.94336,3 RIVERSIDE DR,CAMDEN,NJ,08103-1037
8403400297,Children's museum,JERSEY EXPLORER CHILDREN'S MUSEUM,demo_001.jpg,A52,813219,image/jpeg,URBAN EDUCATIONAL PROJECT-JERSEY EXPLORER CHILDRENS MUSEUM,,,192 DODD ST,EAST ORANGE,NJ,07017-2107,7017,HTTP://WWW.JERSEYEXPLORER.ORG,201312,28835,28835,1984,-74.21015,40.78188,192 DODD ST,EAST ORANGE,NJ,07017-2107
8403400303,Children's museum,TOUCH N TECH CHILDREN'S MUSEUM,demo_001.jpg,,,image/jpeg,TOUCH N TECH CHILDRENS MUSEUM,,,232 BROOKSIDE LANE,SOMERVILLE,NJ,8876,8876,,,,,,-74.6468,40.57617,232 BROOKSIDE LANE,SOMERVILLE,NJ,8876
8403400430,Children's museum,CHILDREN'S MUSEUM,demo_001.jpg,A52,712110,image/jpeg,THE CHILDRENS MUSEUM INC,,,120 FINDERNE AVE SUITE 13,BRIDGEWATER,NJ,08807-3670,8807,,201312,0,0,1997,-74.57569,40.5681,120 FINDERNE AVE SUITE 1,BRIDGEWATER,NJ,08807-3670
8403400433,Children's museum,COMMUNITY CHILDREN'S MUSEUM,demo_001.jpg,A52,,image/jpeg,COMMUNITY CHILDRENS MUSEUM,COMMUNITY CHILDRENS MUSEUM,,77 E BLACKWELL ST,DOVER,NJ,07801-4037,7801,HTTP://WWW.MYCHILDSMUSEUM.ORG,,,,,-74.55449,40.88485,77 E BLACKWELL ST,DOVER,NJ,07801-4037
8403400439,Children's museum,JERSEY SHORE CHILDREN'S MUSEUM,demo_001.jpg,A52,712110,image/jpeg,JERSEY SHORE CHILDRENS MUSEUM INC,,,6725 BLACK HORSE PIKE,EGG HARBOR TOWNSHIP,NJ,08234-6970,8234,,201312,35770,30560,1998,-74.64255,39.36336,116 LIGHTHOUSE LN,EGG HARBOR TOWNSHIP,NJ,08234-6970
8403400518,Children's museum,CHILDREN'S MUSEUM OF CENTRAL NEW JERSEY,demo_001.jpg,A50,,image/jpeg,CHILDRENS MUSEUM OF CENTRAL NEW JERSEY INC,,,PO BOX 277,SUMMIT,NJ,07902-0277,7902,,,,,,-74.35949,40.7162,PO BOX 277,SUMMIT,NJ,07902-0277
8403500077,Children's museum,UNSER CHILDREN'S DISCOVERY CENTER,demo_001.jpg,A50,712110,image/jpeg,UNSER CHILDRENS DISCOVERY CENTER,,,7625 CTRL AVE NW,ALBUQUERQUE,NM,87121,87121,,201312,422946,391802,2002,-106.72934,35.05286,1776 MONTAÑO RD NW,ALBUQUERQUE,NM,87121
